{
  "schema_version": "er_commons.document_link_run_spec.v1",
  "artifact_relative_root": "pipelines/example_collection/relink_run",
  "base_collection": {
    "handoff_ref": {"authority": "artifact_root", "path": "inputs/collection/handoff.json", "sha256": "1111111111111111111111111111111111111111111111111111111111111111", "byte_size": 101},
    "contract_bundle_ref": {"authority": "artifact_root", "path": "inputs/collection/contract_bundle.json", "sha256": "2222222222222222222222222222222222222222222222222222222222222222", "byte_size": 102}
  },
  "base_production_identity_ref": {"authority": "artifact_root", "path": "inputs/identity/base.json", "sha256": "3333333333333333333333333333333333333333333333333333333333333333", "byte_size": 103},
  "replacement_production_identity_recipe_ref": {"authority": "repository", "path": "configs/identity/replacement.json", "sha256": "4444444444444444444444444444444444444444444444444444444444444444", "byte_size": 104},
  "document_publication_spec_ref": {"authority": "repository", "path": "configs/publication/document.json", "sha256": "5555555555555555555555555555555555555555555555555555555555555555", "byte_size": 105},
  "collection_run_spec_ref": {"authority": "repository", "path": "configs/publication/collection.json", "sha256": "5656565656565656565656565656565656565656565656565656565656565656", "byte_size": 106},
  "linking_policy_ref": {"authority": "repository", "path": "configs/linking/document_linking.json", "sha256": "6666666666666666666666666666666666666666666666666666666666666666", "byte_size": 106},
  "linking_policy_schema_ref": {"authority": "repository", "path": "schemas/document_linking/linking_policy.schema.json", "sha256": "6767676767676767676767676767676767676767676767676767676767676767", "byte_size": 108},
  "source_family_catalog_ref": {"authority": "repository", "path": "configs/sources/catalog.json", "sha256": "7777777777777777777777777777777777777777777777777777777777777777", "byte_size": 107},
  "selected_source_ids": ["report_alpha"],
  "documents": [
    {
      "source_id": "report_alpha",
      "source_document": {
        "candidate_id": "docv1-aaaaaaaaaaaaaaaaaaaaaaaaaaaaaaaaaaaaaaaaaaaaaaaaaaaaaaaaaaaaaaaa",
        "completion_ref": {"authority": "artifact_root", "path": "inputs/report_alpha/document/completion.json", "sha256": "8888888888888888888888888888888888888888888888888888888888888888", "byte_size": 108},
        "inventory_ref": {"authority": "artifact_root", "path": "inputs/report_alpha/document/inventory.json", "sha256": "9999999999999999999999999999999999999999999999999999999999999999", "byte_size": 109}
      },
      "structured_document": {
        "candidate_id": "exv1-bbbbbbbbbbbbbbbbbbbbbbbbbbbbbbbbbbbbbbbbbbbbbbbbbbbbbbbbbbbbbbbb",
        "completion_ref": {"authority": "artifact_root", "path": "inputs/report_alpha/structured/completion.json", "sha256": "aaaaaaaaaaaaaaaaaaaaaaaaaaaaaaaaaaaaaaaaaaaaaaaaaaaaaaaaaaaaaaaa", "byte_size": 110},
        "inventory_ref": {"authority": "artifact_root", "path": "inputs/report_alpha/structured/inventory.json", "sha256": "bbbbbbbbbbbbbbbbbbbbbbbbbbbbbbbbbbbbbbbbbbbbbbbbbbbbbbbbbbbbbbbb", "byte_size": 111}
      }
    }
  ],
  "reviewed_navigation": null,
  "output_schema_refs": {
    "identity": {"authority": "repository", "path": "schemas/document_linking/identity.json", "sha256": "cccccccccccccccccccccccccccccccccccccccccccccccccccccccccccccccc", "byte_size": 112},
    "manifest": {"authority": "repository", "path": "schemas/document_linking/manifest.json", "sha256": "cccccccccccccccccccccccccccccccccccccccccccccccccccccccccccccccc", "byte_size": 112},
    "inventory": {"authority": "repository", "path": "schemas/document_linking/inventory.json", "sha256": "cccccccccccccccccccccccccccccccccccccccccccccccccccccccccccccccc", "byte_size": 112},
    "completion": {"authority": "repository", "path": "schemas/document_linking/completion.json", "sha256": "cccccccccccccccccccccccccccccccccccccccccccccccccccccccccccccccc", "byte_size": 112},
    "alias": {"authority": "repository", "path": "schemas/document_linking/alias.json", "sha256": "cccccccccccccccccccccccccccccccccccccccccccccccccccccccccccccccc", "byte_size": 112},
    "ordinary_reference": {"authority": "repository", "path": "schemas/document_linking/ordinary_reference.json", "sha256": "cccccccccccccccccccccccccccccccccccccccccccccccccccccccccccccccc", "byte_size": 112},
    "navigation_entry": {"authority": "repository", "path": "schemas/document_linking/navigation_entry.json", "sha256": "cccccccccccccccccccccccccccccccccccccccccccccccccccccccccccccccc", "byte_size": 112},
    "navigation_relation": {"authority": "repository", "path": "schemas/document_linking/navigation_relation.json", "sha256": "cccccccccccccccccccccccccccccccccccccccccccccccccccccccccccccccc", "byte_size": 112},
    "navigation_decision": {"authority": "repository", "path": "schemas/document_linking/navigation_decision.json", "sha256": "cccccccccccccccccccccccccccccccccccccccccccccccccccccccccccccccc", "byte_size": 112},
    "navigation_link": {"authority": "repository", "path": "schemas/document_linking/navigation_link.json", "sha256": "cccccccccccccccccccccccccccccccccccccccccccccccccccccccccccccccc", "byte_size": 112},
    "support": {"authority": "repository", "path": "schemas/document_linking/support.json", "sha256": "cccccccccccccccccccccccccccccccccccccccccccccccccccccccccccccccc", "byte_size": 112}
  }
}
